{
  "siteId": "a1b2c3d4-1234-4a5b-9c8d-1e2f3a4b5c6d",
  "batteryUnits": [
    {
      "assetId": "11111111-1111-4111-8111-111111111111",
      "states": [
        {
          "timestamp": "2026-08-03T09:00:00+02:00",
          "batteryState": "charging",
          "stateOfCharge": 62.5,
          "stateOfHealth": 97.2,
          "storedEnergy": 8.6
        }
      ]
    }
  ],
  "evChargers": [
    {
      "assetId": "33333333-3333-4333-8333-333333333333",
      "states": [
        {
          "timestamp": "2026-08-03T09:00:00+02:00",
          "evConnected": true,
          "stateOfCharge": 54.0
        }
      ]
    }
  ],
  "heatPumps": [
    {
      "assetId": "44444444-4444-4444-8444-444444444444",
      "states": [
        {
          "timestamp": "2026-08-03T09:00:00+02:00",
          "dhwEnabled": true
        }
      ]
    }
  ]
}
